source,title,text,published,topic,cleaned_text,sentiment_score,subjectivity_score,readability_score
Times of India,"Frustrated, lying on floors, confused: Videos capture chaos as IndiGo cancels 500+ flights; watch","Frustrated, lying on floors, confused: Videos capture chaos as IndiGo cancels 500+ flights; watch India's aviation sector faced a severe meltdown as IndiGo cancelled over 400 flights, leaving thousands stranded and airports in chaos. Passengers endured long waits and exorbitant fares on other airlines due to the crisis, triggered by cabin crew shortages. IndiGo expects full operational recovery only by February 2026, highlighting a significant disruption.","Fri, 05 Dec 2025 14:04:21 +0530",Economy/Market,frustrated lying floors confused videos capture chaos indigo cancels 500 flights watch indias aviation sector faced severe meltdown indigo cancelled 400 flights leaving thousands stranded airports chaos passengers endured long waits exorbitant fares airlines due crisis triggered cabin crew shortages indigo expects full operational recovery february 2026 highlighting significant disruption,-0.9806,0.559375,21.714090909090913
Times of India,'Murdered all kids on Ekadashi': Occult omen or mental illness? Disturbing pattern of Haryana's 'killer mom',"'Murdered all kids on Ekadashi': Occult omen or mental illness? Disturbing pattern of Haryana's 'killer mom' A mother in Hisar/Panipat is accused of drowning four children, including her own son. While her family and victims' kin suspect occult practices, police point to psychopathic tendencies and a lack of remorse. The accused reportedly confessed to killing children perceived as more beautiful than her own. Authorities are investigating further, dismissing supernatural claims.","Fri, 05 Dec 2025 05:12:24 +0530",Economy/Market,murdered kids ekadashi occult omen mental illness disturbing pattern haryanas killer mom mother hisarpanipat accused drowning four children including son family victims kin suspect occult practices police point psychopathic tendencies lack remorse accused reportedly confessed killing children perceived beautiful authorities investigating dismissing supernatural claims,-0.9781,0.6958333333333333,40.345
Times of India,‘Opportunity for us’: RBI governor sees impact of Trump tariffs as ‘minimal’,"‘Opportunity for us’: RBI governor sees impact of Trump tariffs as ‘minimal’ RBI Governor Sanjay Malhotra views US tariffs on Indian economy as a minimal impact, calling it an opportunity for diversification and productivity improvements. Despite a significant 28.5% drop in exports to the US from May to October 2025, the central bank believes the domestic demand-driven economy will emerge stronger.","Fri, 05 Dec 2025 13:32:11 +0530",Economy/Market,opportunity us rbi governor sees impact trump tariffs minimal rbi governor sanjay malhotra views us tariffs indian economy minimal impact calling opportunity diversification productivity improvements despite significant 285 drop exports us may october 2025 central bank believes domestic demanddriven economy emerge stronger,0.7859,0.48500000000000004,19.770437158469974
Times of India,‘Doomsday plane’: What is the ‘Flying Kremlin’? Putin’s jet was the most-tracked flight,"‘Doomsday plane’: What is the ‘Flying Kremlin’? Putin’s jet was the most-tracked flight Russian President Vladimir Putin's specially modified Ilyushin Il-80, dubbed the “Flying Kremlin,” became the world's most tracked flight en route to Delhi. This secure airborne command center, designed for extreme conditions and equipped with advanced communication and defensive systems, underscores Russia's strategic leadership protection.","Fri, 05 Dec 2025 13:58:55 +0530",Politics/Elections,doomsday plane flying kremlin putins jet mosttracked flight russian president vladimir putins specially modified ilyushin il80 dubbed flying kremlin became worlds tracked flight en route delhi secure airborne command center designed extreme conditions equipped advanced communication defensive systems underscores russias strategic leadership protection,0.5423,0.4816326530612245,39.12894736842108
Times of India,Persimmon superfruit: Why it loves your heart and the best ways to eat it,"Persimmon superfruit: Why it loves your heart and the best ways to eat it Discover the persimmon, a new heart-healthy hero. This bright orange fruit offers sweet flavor and a nutrient boost. Research shows persimmons outperform apples in protecting arteries. They are rich in fiber and antioxidants, supporting heart health, digestion, and immunity. Enjoy persimmons in salads, yogurt, or as dried chips for a healthy snack.","Fri, 05 Dec 2025 02:00:00 +0530",Environment/Health,persimmon superfruit loves heart best ways eat discover persimmon new hearthealthy hero bright orange fruit offers sweet flavor nutrient boost research shows persimmons outperform apples protecting arteries rich fiber antioxidants supporting heart health digestion immunity enjoy persimmons salads yogurt dried chips healthy snack,0.9855,0.48045454545454547,55.000636363636374
Times of India,CCTV captures assault: Jeweller stabbed to death during robbery; accused watched 25 ‘tutorials',CCTV captures assault: Jeweller stabbed to death during robbery; accused watched 25 ‘tutorials' A shocking daylight robbery turned fatal in Modinagar. A 75-year-old jeweller was brutally stabbed to death by an assailant who threw chilli powder in his face. The attacker was quickly caught by alert locals after a brief chase. The incident highlights concerns over law and order in the area. Police are investigating the motive and have detained the suspect.,"Fri, 05 Dec 2025 05:51:51 +0530",Politics/Elections,cctv captures assault jeweller stabbed death robbery accused watched 25 tutorials shocking daylight robbery turned fatal modinagar 75yearold jeweller brutally stabbed death assailant threw chilli powder face attacker quickly caught alert locals brief chase incident highlights concerns law order area police investigating motive detained suspect,-0.9884,0.7083333333333334,53.56900000000002
Times of India,"Why RBI cut repo rate even with low inflation, high growth? Sanjay Malhotra explains","Why RBI cut repo rate even with low inflation, high growth? Sanjay Malhotra explains The Reserve Bank of India has reduced the repo rate by 25 basis points to 5.25%, citing benign inflation and a resilient economy. Despite a strong GDP growth forecast of 7.3% for the fiscal year, the central bank sees potential softening ahead. This move aims to support growth momentum while maintaining macroeconomic stability.","Fri, 05 Dec 2025 10:59:50 +0530",Economy/Market,rbi cut repo rate even low inflation high growth sanjay malhotra explains reserve bank india reduced repo rate 25 basis points 525 citing benign inflation resilient economy despite strong gdp growth forecast 73 fiscal year central bank sees potential softening ahead move aims support growth momentum maintaining macroeconomic stability,0.7094,0.5646666666666667,54.079937810945296
Times of India,"'Lived reputed life, GBA officials ruined it': Bengaluru techie’s death note","'Lived reputed life, GBA officials ruined it': Bengaluru techie’s death note A Bengaluru software engineer tragically ended his life, citing harassment by a local family and BBMP officials over alleged building plan violations. A 10-page suicide note details accusations of extortion, with the family allegedly demanding Rs 20 lakh to cease the torment. Police have arrested the couple, with their son being sought.","Fri, 05 Dec 2025 09:41:52 +0530",Crime/Law,lived reputed life gba officials ruined bengaluru techies death note bengaluru software engineer tragically ended life citing harassment local family bbmp officials alleged building plan violations 10page suicide note details accusations extortion family allegedly demanding rs 20 lakh cease torment police arrested couple son sought,-0.9825,0.06666666666666667,31.091428571428594
Times of India,Indian economy in a ‘rare Goldilocks period’: Why RBI governor said this,"Indian economy in a ‘rare Goldilocks period’: Why RBI governor said this The Reserve Bank of India cut its policy repo rate by 25 basis points to 5.25%, while raising the FY26 GDP forecast to 7.3% and lowering inflation to 2%. Governor Sanjay Malhotra announced liquidity measures, citing a ""rare Goldilocks period"" of benign inflation and strong growth.","Fri, 05 Dec 2025 10:57:30 +0530",Economy/Market,indian economy rare goldilocks period rbi governor said reserve bank india cut policy repo rate 25 basis points 525 raising fy26 gdp forecast 73 lowering inflation 2 governor sanjay malhotra announced liquidity measures citing rare goldilocks period benign inflation strong growth,0.6249,0.8444444444444444,46.2554310344828
Times of India,"Putin India visit day-2: Visit to Rajghat, bilateral talks with PM Modi — what’s planned today","Putin India visit day-2: Visit to Rajghat, bilateral talks with PM Modi — what’s planned today Russian President Vladimir Putin's packed second day in Delhi includes a ceremonial welcome at Rashtrapati Bhavan and a visit to Rajghat. Prime Minister Modi and Putin will hold crucial bilateral talks at Hyderabad House, focusing on defense deals like S-400s and Su-57s, nuclear energy, and broader cooperation. Several agreements are anticipated.","Fri, 05 Dec 2025 08:36:36 +0530",Politics/Elections,putin india visit day2 visit rajghat bilateral talks pm modi whats planned today russian president vladimir putins packed second day delhi includes ceremonial welcome rashtrapati bhavan visit rajghat prime minister modi putin hold crucial bilateral talks hyderabad house focusing defense deals like s400s su57s nuclear energy broader cooperation several agreements anticipated,0.8481,0.375,24.277727272727276
Times of India,"RBI rate cut boosts markets: Nifty50 above 26,000; BSE Sensex gains over 230 points","RBI rate cut boosts markets: Nifty50 above 26,000; BSE Sensex gains over 230 points Indian equity benchmarks Nifty50 and BSE Sensex surged today after the RBI, led by Governor Sanjay Malhotra, cut the repo rate by 25 basis points to 5.25%. The economy shows resilience, with GDP growth projected at 7.3%. Despite foreign outflows and a weak rupee, markets are watching the RBI's stance on inflation and liquidity.","Fri, 05 Dec 2025 09:20:08 +0530",Economy/Market,rbi rate cut boosts markets nifty50 26000 bse sensex gains 230 points indian equity benchmarks nifty50 bse sensex surged today rbi led governor sanjay malhotra cut repo rate 25 basis points 525 economy shows resilience gdp growth projected 73 despite foreign outflows weak rupee markets watching rbis stance inflation liquidity,0.0516,0.2833333333333333,51.951862745098055
Times of India,'Was disturbed over health': Bengaluru man strangles paralysed wife; then hangs himself,'Was disturbed over health': Bengaluru man strangles paralysed wife; then hangs himself A 65-year-old retired bus driver strangled his paralyzed wife to death before hanging himself in their Bengaluru home on December 2. The man was reportedly distressed by his wife's deteriorating health condition. Their son confirmed his father had previously threatened to commit such an act.,"Fri, 05 Dec 2025 00:00:58 +0530",Environment/Health,disturbed health bengaluru man strangles paralysed wife hangs 65yearold retired bus driver strangled paralyzed wife death hanging bengaluru home december 2 man reportedly distressed wifes deteriorating health condition son confirmed father previously threatened commit act,-0.9274,0.5555555555555556,48.0342105263158
Times of India,'I have a Rolex too': DK Shivakumar quips at BJP; Rs 43 lakh watch in focus,"'I have a Rolex too': DK Shivakumar quips at BJP; Rs 43 lakh watch in focus Karnataka Deputy CM DK Shivakumar refuted BJP's claims of undeclared assets, asserting full transparency in his affidavit, including a Rolex watch. He also highlighted the Congress government's women empowerment initiatives. Meanwhile, Union Minister Prahlad Joshi criticized the state government for internal divisions, corruption, and infrastructure issues, while addressing Rahul Gandhi's claims about foreign dignitaries.","Fri, 05 Dec 2025 08:13:04 +0530",Politics/Elections,rolex dk shivakumar quips bjp rs 43 lakh watch focus karnataka deputy cm dk shivakumar refuted bjps claims undeclared assets asserting full transparency affidavit including rolex watch also highlighted congress governments women empowerment initiatives meanwhile union minister prahlad joshi criticized state government internal divisions corruption infrastructure issues addressing rahul gandhis claims foreign dignitaries,-0.0516,0.225,15.1602380952381
NDTV,"Police Recover $19,000 James Bond-Inspired Pendant From Man's Excreta","Police Recover $19,000 James Bond-Inspired Pendant From Man's Excreta Faberge egg pendant was inspired by the 1983 James Bond film ""Octopussy,""","Fri, 05 Dec 2025 13:47:09 +0530",Crime/Law,police recover 19000 james bondinspired pendant mans excreta faberge egg pendant inspired 1983 james bond film octopussy,0.4939,0.0,48.54857142857145
NDTV,"Sharad Pawar's Family In Focus As Jay Pawar, Rutuja Patil Set To Marry: Who Are They?","Sharad Pawar's Family In Focus As Jay Pawar, Rutuja Patil Set To Marry: Who Are They? The ceremonies are scheduled from December 4 to December 7 in Bahrain.","Fri, 05 Dec 2025 13:44:27 +0530",Environment/Health,sharad pawars family focus jay pawar rutuja patil set marry ceremonies scheduled december 4 december 7 bahrain,0.0,0.0,62.70357142857142
NDTV,What Putin Wrote About Mahatma Gandhi On Visitors' Book At Rajghat,What Putin Wrote About Mahatma Gandhi On Visitors' Book At Rajghat Putin is in India on a two-day visit to attend the 23rd India-Russia Annual Summit.,"Fri, 05 Dec 2025 13:16:48 +0530",Politics/Elections,putin wrote mahatma gandhi visitors book rajghat putin india twoday visit attend 23rd indiarussia annual summit,0.0,0.0,37.27576923076927
NDTV,Hyderabad Woman Cheated Of Rs 3.38 Lakh By Fake UK Doctor,"Hyderabad Woman Cheated Of Rs 3.38 Lakh By Fake UK Doctor The man pressured the woman to send passbooks and ATM cards to a bogus ""UK Affairs Office"".","Fri, 05 Dec 2025 13:01:20 +0530",Environment/Health,hyderabad woman cheated rs 338 lakh fake uk doctor man pressured woman send passbooks atm cards bogus uk affairs office,-0.8074,1.0,71.76785714285715
NDTV,Vladimir Putin In India LIVE Updates: Putin Thanks PM Modi For Ukraine Peace Efforts During Bilateral Talks,Vladimir Putin In India LIVE Updates: Putin Thanks PM Modi For Ukraine Peace Efforts During Bilateral Talks Putin Modi Talks LIVE Updates: Russian President Vladimir Putin is in India for his two-day state visit,"Fri, 05 Dec 2025 12:33:34 +0530",Politics/Elections,vladimir putin india live updates putin thanks pm modi ukraine peace efforts bilateral talks putin modi talks live updates russian president vladimir putin india twoday state visit,0.7506,0.3,28.007352941176492
NDTV,"PM Modi, Putin At Hyderabad House After Rajghat Visit, Guard Of Honour","PM Modi, Putin At Hyderabad House After Rajghat Visit, Guard Of Honour Putin is in India at a time when New Delhi is engaged in talks with the US","Fri, 05 Dec 2025 12:15:35 +0530",Politics/Elections,pm modi putin hyderabad house rajghat visit guard honour putin india time new delhi engaged talks us,0.7506,0.45454545454545453,54.87586206896553
NDTV,"""Rare Goldilocks Period"": RBI Celebrates High Growth, Record Low Inflation","""Rare Goldilocks Period"": RBI Celebrates High Growth, Record Low Inflation RBI Governor Sanjay Malhotra on Friday characterised India's current macroeconomic moment as a ""rare goldilocks period"", that currently marks high economic growth and exceptionally low inflation.","Fri, 05 Dec 2025 12:06:37 +0530",Economy/Market,rare goldilocks period rbi celebrates high growth record low inflation rbi governor sanjay malhotra friday characterised indias current macroeconomic moment rare goldilocks period currently marks high economic growth exceptionally low inflation,0.6605,0.4977777777777777,-10.654999999999973
India Today,PM Narendra Modi Tells Vladimir Putin India Is Not Neutral But On The Side Of Peace In Ukraine War,"PM Narendra Modi Tells Vladimir Putin India Is Not Neutral But On The Side Of Peace In Ukraine War <a href=""https://www.indiatoday.in/india/video/pm-narendra-modi-tells-vladimir-putin-india-is-not-neutral-but-on-the-side-of-peace-in-ukraine-war-ytvd-2831234-2025-12-05""> <img align=""left"" alt="""" border=""0"" height=""180"" hspace=""2"" src=""https://akm-img-a-in.tosshub.com/indiatoday/images/video/202512/pmmoditoputinindiaisonthesideofpeace-s0-original-sixteen-to-nine.jpg?VersionId=Beyt8XcBPJlN4Y8v2LD1eoAZbnmaAmIU"" width=""305"" /> </a> PM Narendra Modi Tells Vladimir Putin India Is Not Neutral But On The Side Of Peace In Ukraine War","Fri, 05 Dec 2025 13:58:36 +0530",Politics/Elections,pm narendra modi tells vladimir putin india neutral side peace ukraine war pm narendra modi tells vladimir putin india neutral side peace ukraine war,-0.296,0.0,-29.01272108843534
India Today,Supreme Court dismisses plea alleging Arundhati Roy's book cover promoted smoking,"Supreme Court dismisses plea alleging Arundhati Roy's book cover promoted smoking <a href=""https://www.indiatoday.in/india/law-news/story/supreme-court-dismisses-plea-alleging-author-arundhati-roys-book-cover-promoted-smoking-2831226-2025-12-05""> <img align=""left"" alt="""" border=""0"" height=""180"" hspace=""2"" src=""https://akm-img-a-in.tosshub.com/indiatoday/images/story/202512/arundhati-roy-191544318-16x9.png?VersionId=wHz_J.ZzJsMYPGPzJJ.b39DdkxwXOEY1"" width=""305"" /> </a> Supreme Court dismisses plea alleging Arundhati Roy's book cover promoted smoking","Fri, 05 Dec 2025 13:52:30 +0530",Crime/Law,supreme court dismisses plea alleging arundhati roys book cover promoted smoking supreme court dismisses plea alleging arundhati roys book cover promoted smoking,0.9153,0.0,-78.63909090909084
India Today,"Detailed Look At India-Russia Relations, Space Exploration And High-Tech Cooperation","Detailed Look At India-Russia Relations, Space Exploration And High-Tech Cooperation <a href=""https://www.indiatoday.in/india/video/special-report-on-india-russia-strategic-ties-and-ukraine-peace-settlement-efforts-ytvd-2831220-2025-12-05""> <img align=""left"" alt="""" border=""0"" height=""180"" hspace=""2"" src=""https://akm-img-a-in.tosshub.com/indiatoday/images/video/202512/reportonindia-russiatiesandukraine-s0-original-sixteen-to-nine.jpg?VersionId=ociTrbinGsFn7slWJS4LOAZ7mphKSCx."" width=""305"" /> </a> Detailed Look At India-Russia Relations, Space Exploration And High-Tech Cooperation","Fri, 05 Dec 2025 13:42:24 +0530",Economy/Market,detailed look indiarussia relations space exploration hightech cooperation detailed look indiarussia relations space exploration hightech cooperation,0.4215,0.5,-122.95010752688174
India Today,TN BJP President Nainar Nagendran Arrested in Thiruparankundram Deepam Row,"TN BJP President Nainar Nagendran Arrested in Thiruparankundram Deepam Row <a href=""https://www.indiatoday.in/india/video/report-by-devraj-tn-bjp-president-nainar-nagendran-arrested-in-thiruparankundram-deepam-row-ytvd-2831215-2025-12-05""> <img align=""left"" alt="""" border=""0"" height=""180"" hspace=""2"" src=""https://akm-img-a-in.tosshub.com/indiatoday/images/video/202512/devrajbjpsnainarnagendranheldinmadurai-s0-original-sixteen-to-nine.jpg?VersionId=irGe194RPX8klb1DQqcn69LYkUgslEku"" width=""305"" /> </a> TN BJP President Nainar Nagendran Arrested in Thiruparankundram Deepam Row","Fri, 05 Dec 2025 13:32:43 +0530",Politics/Elections,tn bjp president nainar nagendran arrested thiruparankundram deepam row tn bjp president nainar nagendran arrested thiruparankundram deepam row,-0.7351,0.0,-120.22107526881715
India Today,Putin Pays Tribute To Mahatma Gandhi At Rajghat; 23rd India-Russia Summit Talks Begin Today,"Putin Pays Tribute To Mahatma Gandhi At Rajghat; 23rd India-Russia Summit Talks Begin Today <a href=""https://www.indiatoday.in/india/video/putin-pays-tribute-to-mahatma-gandhi-at-rajghat-23rd-india-russia-summit-talks-begin-today-ytvd-2831182-2025-12-05""> <img align=""left"" alt="""" border=""0"" height=""180"" hspace=""2"" src=""https://akm-img-a-in.tosshub.com/indiatoday/images/video/202512/putininindiarajghattributesummittalks-s0-original-sixteen-to-nine.jpg?VersionId=TlcxW_7aO38SMKNUJWLE.xghP2YHLPdi"" width=""305"" /> </a> Putin Pays Tribute To Mahatma Gandhi At Rajghat; 23rd India-Russia Summit Talks Begin Today","Fri, 05 Dec 2025 12:30:03 +0530",Politics/Elections,putin pays tribute mahatma gandhi rajghat 23rd indiarussia summit talks begin today putin pays tribute mahatma gandhi rajghat 23rd indiarussia summit talks begin today,0.0,0.0,-68.83692307692306
India Today,"India not neutral, is on side of peace: PM's message to Putin on Ukraine war","India not neutral, is on side of peace: PM's message to Putin on Ukraine war <a href=""https://www.indiatoday.in/india/story/putin-in-india-pm-modi-meeting-india-on-side-of-peace-ukraine-war-2831180-2025-12-05""> <img align=""left"" alt="""" border=""0"" height=""180"" hspace=""2"" src=""https://akm-img-a-in.tosshub.com/indiatoday/images/story/202512/putin-in-india-053035161-16x9_0.jpg?VersionId=MfQKFlOOyzFDC5VFy0PrHbKQL3N.dACV"" width=""305"" /> </a> India not neutral, is on side of peace: PM's message to Putin on Ukraine war","Fri, 05 Dec 2025 12:28:48 +0530",Politics/Elections,india neutral side peace pms message putin ukraine war india neutral side peace pms message putin ukraine war,-0.2023,0.0,-7.18788617886176
India Today,President Putin Arrives at Rashtrapati Bhavan; Meets PM Modi and President Murmu,"President Putin Arrives at Rashtrapati Bhavan; Meets PM Modi and President Murmu <a href=""https://www.indiatoday.in/india/video/maria-shakil-on-president-putins-historic-visit-ceremonial-welcome-at-rashtrapati-bhavan-and-strategic-ties-ytvd-2831168-2025-12-05""> <img align=""left"" alt="""" border=""0"" height=""180"" hspace=""2"" src=""https://akm-img-a-in.tosshub.com/indiatoday/images/video/202512/mariashakilputinsstrategicvisittoindia-s0-original-sixteen-to-nine.jpg?VersionId=tlJ9SjEltdf82qzgXI3t_swsW7ltd1Go"" width=""305"" /> </a> President Putin Arrives at Rashtrapati Bhavan; Meets PM Modi and President Murmu","Fri, 05 Dec 2025 12:08:20 +0530",Politics/Elections,president putin arrives rashtrapati bhavan meets pm modi president murmu president putin arrives rashtrapati bhavan meets pm modi president murmu,0.0,0.0,-114.40095238095233
India Today,"Putin In India: Focus On $100 Billion Trade, Shipbuilding As PM Modi Hosts Russian President","Putin In India: Focus On $100 Billion Trade, Shipbuilding As PM Modi Hosts Russian President <a href=""https://www.indiatoday.in/india/video/putin-in-india-focus-on-100-billion-trade-shipbuilding-as-pm-modi-hosts-russian-president-ytvd-2831164-2025-12-05""> <img align=""left"" alt="""" border=""0"" height=""180"" hspace=""2"" src=""https://akm-img-a-in.tosshub.com/indiatoday/images/video/202512/putininindia100billiontradepush-s0-original-sixteen-to-nine.jpg?VersionId=Uf6.25f855sulk3IQ6UmgO9ngZa8jS_Y"" width=""305"" /> </a> Putin In India: Focus On $100 Billion Trade, Shipbuilding As PM Modi Hosts Russian President","Fri, 05 Dec 2025 12:03:57 +0530",Politics/Elections,putin india focus 100 billion trade shipbuilding pm modi hosts russian president putin india focus 100 billion trade shipbuilding pm modi hosts russian president,0.0,0.0,-64.96349593495935
India Today,PM Modi Arrives at Rashtrapati Bhavan for Vladimir Putin Ceremonial Welcome,"PM Modi Arrives at Rashtrapati Bhavan for Vladimir Putin Ceremonial Welcome <a href=""https://www.indiatoday.in/india/video/live-report-russian-president-vladimir-putin-arrives-at-rashtrapati-bhavan-for-ceremonial-welcome-ytvd-2831139-2025-12-05""> <img align=""left"" alt="""" border=""0"" height=""180"" hspace=""2"" src=""https://akm-img-a-in.tosshub.com/indiatoday/images/video/202512/presidentputinarrivesinindiasmrtradetalks-s0-original-sixteen-to-nine.jpg?VersionId=SXCmWYOiYTQ2o2hqcc7Kc3vKXCwnxxEY"" width=""305"" /> </a> PM Modi Arrives at Rashtrapati Bhavan for Vladimir Putin Ceremonial Welcome","Fri, 05 Dec 2025 11:49:55 +0530",Politics/Elections,pm modi arrives rashtrapati bhavan vladimir putin ceremonial welcome pm modi arrives rashtrapati bhavan vladimir putin ceremonial welcome,0.7184,0.5,-132.4754545454545
HindustanTimes,"Woman reaches Kochi from Delhi, her suitcase doesn’t: Spouse blames IndiGo","Woman reaches Kochi from Delhi, her suitcase doesn’t: Spouse blames IndiGo Social media is filled with posts of people complaining about delays in IndiGo flights.","Fri, 05 Dec 2025 10:21:15 +0530",Crime/Law,woman reaches kochi delhi suitcase doesnt spouse blames indigo social media filled posts people complaining delays indigo flights,-0.5106,0.48333333333333334,39.33200000000002
HindustanTimes,Amon-Ra St Brown playing with injury? The Lions vs the Cowboys game causes major concerns,Amon-Ra St Brown playing with injury? The Lions vs the Cowboys game causes major concerns Star receiver cleared to play despite low-ankle sprain. Fans disappointed in the game play and worry about long-term risks as Lions battle for playoff position.,"Fri, 05 Dec 2025 07:40:25 +0530",Environment/Health,amonra st brown playing injury lions vs cowboys game causes major concerns star receiver cleared play despite lowankle sprain fans disappointed game play worry longterm risks lions battle playoff position,-0.7579,0.5125,55.82666666666668
