source,title,text,published,topic,cleaned_text,sentiment_score,subjectivity_score,readability_score
HindustanTimes,"'Eyes burning, throat gone': Entrepreneur describes impact of Delhi, Amritsar air pollution","'Eyes burning, throat gone': Entrepreneur describes impact of Delhi, Amritsar air pollution The co-founder said that within hours of arriving from Ahmedabad, she felt her “eyes burning,” her throat giving out, and her sinuses shutting down.","Thu, 04 Dec 2025 21:41:05 +0530",Politics/Elections,eyes burning throat gone entrepreneur describes impact delhi amritsar air pollution cofounder said within hours arriving ahmedabad felt eyes burning throat giving sinuses shutting,0.34,0.2888888888888889,31.64500000000004
HindustanTimes,"Man swallows $19,000 James Bond-inspired pendant, police wait for him to defecate","Man swallows $19,000 James Bond-inspired pendant, police wait for him to defecate The man is accused of gulping down a limited-edition Faberge octopus pendant inspired by the 1983 James Bond film Octopussy.","Thu, 04 Dec 2025 16:22:54 +0530",Crime/Law,man swallows 19000 james bondinspired pendant police wait defecate man accused gulping limitededition faberge octopus pendant inspired 1983 james bond film octopussy,0.25,0.2888888888888889,42.16750000000002
HindustanTimes,"Food order led to arrest of Ravindra Nath Soni, key accused in Dubai BlueChip scam","Food order led to arrest of Ravindra Nath Soni, key accused in Dubai BlueChip scam Ravindra Nath Soni, prime suspect in a major UAE investment fraud, was arrested in Dehradun after an 18-month manhunt","Thu, 04 Dec 2025 10:15:14 +0530",Crime/Law,food order led arrest ravindra nath soni key accused dubai bluechip scam ravindra nath soni prime suspect major uae investment fraud arrested dehradun 18month manhunt,-0.9468,0.5,42.93676470588238
HindustanTimes,Matthew Perry’s parents call out doctor in emotional letters ahead of sentencing,"Matthew Perry’s parents call out doctor in emotional letters ahead of sentencing Matthew Perry’s parents have submitted emotional letters urging a tough sentence for Dr. Salvador Plasencia, calling him “among the most culpable of all.”","Wed, 03 Dec 2025 20:54:52 +0530",Environment/Health,matthew perrys parents call doctor emotional letters ahead sentencing matthew perrys parents submitted emotional letters urging tough sentence dr salvador plasencia calling among culpable,0.1027,0.6583333333333333,31.95821428571432
HindustanTimes,Illegal Indian truck driver Rajinder Kumar arrested in US after Oregon crash kills newlywed couple,"Illegal Indian truck driver Rajinder Kumar arrested in US after Oregon crash kills newlywed couple Rajinder Kumar jackknifed his semi-truck and collided with a vehicle in Bend on November 24, killing William Carter and his wife, Jennifer Lower.","Wed, 03 Dec 2025 16:43:51 +0530",Crime/Law,illegal indian truck driver rajinder kumar arrested us oregon crash kills newlywed couple rajinder kumar jackknifed semitruck collided vehicle bend november 24 killing william carter wife jennifer lower,-0.9612,0.5,12.422894736842125
HindustanTimes,"US vlogger visits remote Himalayan village, moved by locals’ heartfelt ‘Khana kha ke jana’","US vlogger visits remote Himalayan village, moved by locals’ heartfelt ‘Khana kha ke jana’ A US travel vlogger was impressed by the warmth and hospitality of a remote Himalayan village.","Wed, 03 Dec 2025 15:49:58 +0530",Environment/Health,us vlogger visits remote himalayan village moved locals heartfelt khana kha ke jana us travel vlogger impressed warmth hospitality remote himalayan village,0.8625,0.6000000000000001,29.745000000000033
FirstPost,Vice presidential elections 2025: Fast facts on CP Radhakrishnan and B Sudershan Reddy,Vice presidential elections 2025: Fast facts on CP Radhakrishnan and B Sudershan Reddy Vice presidential elections 2025: Fast facts on CP Radhakrishnan and B Sudershan Reddy,"Tue, 9 Sep 2025 10:47:32 +0530",Politics/Elections,vice presidential elections 2025 fast facts cp radhakrishnan b sudershan reddy vice presidential elections 2025 fast facts cp radhakrishnan b sudershan reddy,0.0,0.6,24.260384615384652
FirstPost,Rained out: 10 wettest places in India,Rained out: 10 wettest places in India Rained out: 10 wettest places in India,"Tue, 19 Aug 2025 12:28:06 +0530",Environment/Health,rained 10 wettest places india rained 10 wettest places india,0.0,0.0,59.68214285714288
FirstPost,Health Boost in a Bite: 10 benefits of eating soaked figs,Health Boost in a Bite: 10 benefits of eating soaked figs Health Boost in a Bite: 10 benefits of eating soaked figs,"Wed, 13 Aug 2025 11:00:44 +0530",Environment/Health,health boost bite 10 benefits eating soaked figs health boost bite 10 benefits eating soaked figs,0.8625,0.0,76.83227272727274
FirstPost,More than a spice: 10 health benefits of black pepper,More than a spice: 10 health benefits of black pepper More than a spice: 10 health benefits of black pepper,"Fri, 8 Aug 2025 11:05:59 +0530",Environment/Health,spice 10 health benefits black pepper spice 10 health benefits black pepper,0.6369,0.4666666666666667,76.55500000000004
FirstPost,From digestion to immunity: 10 health perks of boiled potatoes,From digestion to immunity: 10 health perks of boiled potatoes From digestion to immunity: 10 health perks of boiled potatoes,"Fri, 1 Aug 2025 10:23:12 +0530",Environment/Health,digestion immunity 10 health perks boiled potatoes digestion immunity 10 health perks boiled potatoes,0.0,0.0,42.71500000000003
FirstPost,The Magic of Moringa: 10 health benefits of drumstick leaves,The Magic of Moringa: 10 health benefits of drumstick leaves The Magic of Moringa: 10 health benefits of drumstick leaves,"Thu, 31 Jul 2025 13:34:20 +0530",Environment/Health,magic moringa 10 health benefits drumstick leaves magic moringa 10 health benefits drumstick leaves,0.6369,1.0,68.09500000000004
FirstPost,Sweet and Smart: 10 healthy ways to use sweet potatoes,Sweet and Smart: 10 healthy ways to use sweet potatoes Sweet and Smart: 10 healthy ways to use sweet potatoes,"Wed, 23 Jul 2025 11:19:26 +0530",Environment/Health,sweet smart 10 healthy ways use sweet potatoes sweet smart 10 healthy ways use sweet potatoes,0.9674,0.6107142857142858,76.55500000000004
FirstPost,World Brain Day 2025: 10 everyday habits that are quietly damaging your brain,World Brain Day 2025: 10 everyday habits that are quietly damaging your brain World Brain Day 2025: 10 everyday habits that are quietly damaging your brain,"Tue, 22 Jul 2025 11:24:23 +0530",Environment/Health,world brain day 2025 10 everyday habits quietly damaging brain world brain day 2025 10 everyday habits quietly damaging brain,-0.765,0.4666666666666666,50.29115384615386
FirstPost,Eat more zucchini! 10 ways it boosts your health,Eat more zucchini! 10 ways it boosts your health Eat more zucchini! 10 ways it boosts your health,"Fri, 18 Jul 2025 18:22:21 +0530",Environment/Health,eat zucchini 10 ways boosts health eat zucchini 10 ways boosts health,0.6351,0.5,97.345
FirstPost,The Power of 10: Health benefits of just 10 minutes of exercise daily,The Power of 10: Health benefits of just 10 minutes of exercise daily The Power of 10: Health benefits of just 10 minutes of exercise daily,"Fri, 18 Jul 2025 13:14:32 +0530",Environment/Health,power 10 health benefits 10 minutes exercise daily power 10 health benefits 10 minutes exercise daily,0.6369,0.0,50.29115384615386
FirstPost,Soupy Delights: 10 soups to savour in the rain,Soupy Delights: 10 soups to savour in the rain Soupy Delights: 10 soups to savour in the rain,"Tue, 15 Jul 2025 15:01:52 +0530",Environment/Health,soupy delights 10 soups savour rain soupy delights 10 soups savour rain,0.7184,0.0,85.16499999999999
FirstPost,"Tiny tummies, big brains: 10 must-have foods for toddlers","Tiny tummies, big brains: 10 must-have foods for toddlers Tiny tummies, big brains: 10 must-have foods for toddlers","Mon, 14 Jul 2025 18:10:20 +0530",Environment/Health,tiny tummies big brains 10 musthave foods toddlers tiny tummies big brains 10 musthave foods toddlers,0.0,0.30000000000000004,75.76500000000001
FirstPost,Love Cheese? Have these 10 healthy options without fretting about weight,Love Cheese? Have these 10 healthy options without fretting about weight Love Cheese? Have these 10 healthy options without fretting about weight,"Mon, 14 Jul 2025 12:54:28 +0530",Environment/Health,love cheese 10 healthy options without fretting weight love cheese 10 healthy options without fretting weight,0.9344,0.55,72.61545454545457
FirstPost,"No sunshine, no problem: 10 fun ways to spend a rainy weekend","No sunshine, no problem: 10 fun ways to spend a rainy weekend No sunshine, no problem: 10 fun ways to spend a rainy weekend","Wed, 2 Jul 2025 11:17:47 +0530",Environment/Health,sunshine problem 10 fun ways spend rainy weekend sunshine problem 10 fun ways spend rainy weekend,0.0516,0.2,69.67500000000004
FirstPost,Let It Rain! 10 Himachal dishes to relish in the rains,Let It Rain! 10 Himachal dishes to relish in the rains Let It Rain! 10 Himachal dishes to relish in the rains,"Wed, 2 Jul 2025 10:22:02 +0530",Environment/Health,let rain 10 himachal dishes relish rains let rain 10 himachal dishes relish rains,0.0,0.0,91.71893939393942
FirstPost,Rain-Proof Your Home: 10 easy tips for the monsoon season,Rain-Proof Your Home: 10 easy tips for the monsoon season Rain-Proof Your Home: 10 easy tips for the monsoon season,"Mon, 30 Jun 2025 11:15:04 +0530",Environment/Health,rainproof home 10 easy tips monsoon season rainproof home 10 easy tips monsoon season,0.7003,0.8333333333333334,68.09500000000004
FirstPost,Rain and Rasam: 10 South Indian dishes made for monsoons,Rain and Rasam: 10 South Indian dishes made for monsoons Rain and Rasam: 10 South Indian dishes made for monsoons,"Fri, 27 Jun 2025 12:33:49 +0530",Environment/Health,rain rasam 10 south indian dishes made monsoons rain rasam 10 south indian dishes made monsoons,0.0,0.0,68.09500000000004
ABP News,"'India Not Neutral, On Side Of Peace': PM Modi Tells Putin On Russia-Ukraine Conflict","'India Not Neutral, On Side Of Peace': PM Modi Tells Putin On Russia-Ukraine Conflict 'India Not Neutral, On Side Of Peace': PM Modi Tells Putin On Russia-Ukraine Conflict","Fri, 5 Dec 2025 13:15:24 +0530",Politics/Elections,india neutral side peace pm modi tells putin russiaukraine conflict india neutral side peace pm modi tells putin russiaukraine conflict,-0.5574,0.0,45.4721428571429
ABP News,"RBI MPC December: India To Grow Faster Than Earlier Thought, Central Bank Now Expects 7.3% GDP In FY26","RBI MPC December: India To Grow Faster Than Earlier Thought, Central Bank Now Expects 7.3% GDP In FY26 India To Grow Faster Than Earlier Thought, RBI Now Expects 7.3% GDP In FY26","Fri, 5 Dec 2025 10:45:13 +0530",Economy/Market,rbi mpc december india grow faster earlier thought central bank expects 73 gdp fy26 india grow faster earlier thought rbi expects 73 gdp fy26,0.0,0.4166666666666667,71.75208333333336
ABP News,"RBI MPC Meet Dec 2025: Dalal Street Welcomes Central Bank's Repo Rate Cut, Sensex Over 85,700","RBI MPC Meet Dec 2025: Dalal Street Welcomes Central Bank's Repo Rate Cut, Sensex Over 85,700 RBI MPC Meet Dec 2025: Panel Slashes Repo Rate, Maintains 'Neutral' Stance","Fri, 5 Dec 2025 08:06:15 +0530",Economy/Market,rbi mpc meet dec 2025 dalal street welcomes central banks repo rate cut sensex 85700 rbi mpc meet dec 2025 panel slashes repo rate maintains neutral stance,-0.0516,0.25,60.579285714285746
ABP News,"RBI MPC December: Rate Cut Triggers Dalal Street Rally, Sensex Over 85,500, Nifty Crosses 26,100","RBI MPC December: Rate Cut Triggers Dalal Street Rally, Sensex Over 85,500, Nifty Crosses 26,100 RBI MPC's Rate Cut Triggers Dalal Street Rally, Sensex Over 85,500, Nifty Crosses 26,100","Fri, 5 Dec 2025 12:45:07 +0530",Economy/Market,rbi mpc december rate cut triggers dalal street rally sensex 85500 nifty crosses 26100 rbi mpcs rate cut triggers dalal street rally sensex 85500 nifty crosses 26100,0.296,0.0,46.12413793103451
ABP News,'Cost Of Govt's Monopoly Model': Rahul Gandhi Slams Centre Over IndiGo 'Fiasco','Cost Of Govt's Monopoly Model': Rahul Gandhi Slams Centre Over IndiGo 'Fiasco' 'Cost Of Govt's Monopoly Model': Rahul Gandhi Slams Centre Over IndiGo 'Fiasco',"Fri, 5 Dec 2025 12:29:20 +0530",Politics/Elections,cost govts monopoly model rahul gandhi slams centre indigo fiasco cost govts monopoly model rahul gandhi slams centre indigo fiasco,0.0,0.0,6.225000000000023
ABP News,Modi–Putin Diplomacy On Wheels: Why The Russian President Rode With PM In A White Fortuner This Time,Modi–Putin Diplomacy On Wheels: Why The Russian President Rode With PM In A White Fortuner This Time Modi–Putin Diplomacy On Wheels: Why The Russian President Rode With PM In A White Fortuner This Time,"Fri, 5 Dec 2025 08:54:08 +0530",Politics/Elections,modiputin diplomacy wheels russian president rode pm white fortuner time modiputin diplomacy wheels russian president rode pm white fortuner time,0.0,0.0,47.91323529411767
